PT	AU	BA	BE	GP	AF	BF	CA	TI	SO	SE	BS	LA	DT	CT	CY	CL	SP	HO	DE	ID	AB	C1	RP	EM	RI	OI	FU	FX	CR	NR	TC	Z9	U1	U2	PU	PI	PA	SN	EI	BN	J9	JI	PD	PY	VL	IS	PN	SU	SI	MA	BP	EP	AR	DI	D2	EA	PG	WC	SC	GA	UT	PM	OA	HC	HP	DA
J	Rahman, MM; Kumaraswamy, MM				Rahman, MM; Kumaraswamy, MM			Potential for implementing relational contracting and joint risk management	JOURNAL OF MANAGEMENT IN ENGINEERING			English	Article								This paper focuses on the outcomes of the second survey in a broad Hong Kong-based study on joint risk management (JRM) through relational contracting (RC). The questionnaire survey itself focused on issues relating to the formation of a coalesced team for JRM at the postcontract stage, comprising owners, consultants, contractors, subcontractors, and suppliers. Results indicate the greater importance of more relational, trust, and joint responsibility-related factors in general, both for selecting different parties and for building a successful relational contract. While some differences in group perceptions emerge, respondents recommend mobilizing project participants at earlier stages of projects, that is, mostly before the contract award, and they strongly support the JRM option for managing various unforeseen risks. Respondents also suggest adjustment/extension of contract provisions for managing unforeseen events, indicating emerging preferences for flexibility in contracts. All these are indicative of a perceived trend toward more RC, teamworking, and collaborative working environments.	Univ Hong Kong, Dept Civil Engn, Hong Kong, Hong Kong, Peoples R China	Rahman, MM (corresponding author), Univ Hong Kong, Dept Civil Engn, Hong Kong, Hong Kong, Peoples R China.	mmrahman@hkusua.hku.hk; mohan@hkucc.hku.hk	Rahman, Motiar/AAH-8459-2021; Kumaraswamy, Mohan/C-1802-2009	Rahman, Motiar/0000-0002-0042-4124; 				14	68	71	1	30	ASCE-AMER SOC CIVIL ENGINEERS	RESTON	1801 ALEXANDER BELL DR, RESTON, VA 20191-4400 USA	0742-597X	1943-5479		J MANAGE ENG	J. Manage. Eng.	OCT	2004	20	4					178	189		10.1061/(ASCE)0742-597X(2004)20:4(178)			12	Engineering, Industrial; Engineering, Civil	Engineering	914RO	WOS:000228245500007					2021-12-21	
J	Lam, KC; Palaneeswaran, E; Yu, CY				Lam, Ka Chi; Palaneeswaran, Ekambaram; Yu, Chen-yun			A support vector machine model for contractor prequalification	AUTOMATION IN CONSTRUCTION			English	Article						Pre-qualification; Contractor selection; Procurement; Support vector machine; Artificial neural network	HONG-KONG; SELECTION; SYSTEM; CRITERIA; PERFORMANCE; PREDICTION; PROJECTS; CLIENT	In complex and high value projects, prequalification is crucial for both contractors and clients, as it targets towards best value delivery through qualification safeguards and streamlined competition among potential candidates. Due the complex nature of the procurement problems such as prequalification exercises, the robust models are rarely attempted. The research reported in this paper presents an overview of potential suitability of Support Vector Machine (SVM) method for contractor/consultant prequalification transactions in the construction project procurements. Furthermore, the performance of SVM is compared with specific artificial neural network outcomes. The results obtained from practical datasets indicate encouraging potentials for SVM applications in the procurement problems such as prequalification and contractor selection. Hence, a SVM-based decision support framework is proposed. (C) 2008 Elsevier B.V. All rights reserved.	[Lam, Ka Chi; Palaneeswaran, Ekambaram; Yu, Chen-yun] City Univ Hong Kong, Dept Bldg & Construct, Kowloon Tong, Hong Kong, Peoples R China	Palaneeswaran, E (corresponding author), City Univ Hong Kong, Dept Bldg & Construct, 83 Tat Chee Ave, Kowloon Tong, Hong Kong, Peoples R China.	bckclam@cityu.edu.hk; palanees@graduate.hku.hk; chenyunyu3@cityu.edu.hk	Ekambaram, Palaneeswaran/I-6481-2013	LAM, Ka Chi/0000-0002-4573-6631	Research Grants Council of Hong Kong Special Administration Region, ChinaHong Kong Research Grants Council [9041155]	The work described in this paper was fully supported by a grant from the Research Grants Council of Hong Kong Special Administration Region, China I Project No.: 9041155, (RGC Ref No.: CITYU/7126/ 06E)I. The useful contributions of Miss Lei Lei for arranging the datasets of 'Data-11' (i.e. from six Chinese project procurements) and related initial modeling works are thankfully acknowledged. The authors are grateful for the experts/practitioners who provided useful information/datasets and shared their valuable experiences with the research team. Also, the authors wish to specially thank the PICK-svmpredictexe train.txt model-G.txt testoutLG.tKt > predictout _G.txt svmpredictexe train.txt model-H.txt testout-H.txt > predictout-H.txt svmpredict.exe train.txt model-Ltxt testoutLL.txt > predictout _Lxxt svmpredict.exe train.txt model-M.txt testout _Mxxt> predictoutLM.txt		53	54	54	2	42	ELSEVIER SCIENCE BV	AMSTERDAM	PO BOX 211, 1000 AE AMSTERDAM, NETHERLANDS	0926-5805	1872-7891		AUTOMAT CONSTR	Autom. Constr.	MAY	2009	18	3					321	329		10.1016/j.autcon.2008.09.007			9	Construction & Building Technology; Engineering, Civil	Construction & Building Technology; Engineering	419HV	WOS:000264211200010					2021-12-21	
J	Aibinu, AA; Al-Lawati, AM				Aibinu, Ajibade Ayodeji; Al-Lawati, Ahmed Murtadha			Using PLS-SEM technique to model construction organizations' willingness to participate in e-bidding	AUTOMATION IN CONSTRUCTION			English	Article						E-bidding; Procurement; Consultants; Contractors; Clients; Suppliers; Structural equation modeling; Partial least square	STRUCTURAL EQUATION MODELS; E-BANKING	The push for the use of e-bidding is on the increase. In many countries, e-bidding has become part of the public procurement reform. However, previous studies have reported the low uptake of e-bidding in the construction industry. This study develops a theoretical structural model representing the impact six latent variables on the willingness of construction organizations to participate in e-bidding. Data from a questionnaire survey of 64 respondents from clients, contractors, consultants, and suppliers organizations was used to analyze the model. The result of the data analysis suggests that perceived barriers, cost, the perceived benefits of e-bidding and security concerns are the factors influencing willingness participate in e-bidding with perceived barriers being the most significant influencing factor. The perception about the adequacy of the existing traditional paper-based tendering and the perception about the non-readiness of business partners are the underlying barriers that need to be addressed when introducing e-biding. This study also discovers that when the respondents concern about the cost of e-bidding is high, their reported willingness to participate in e-bidding is higher when the perceived benefits is high that when the perceived benefits is low. To enhance the participation of the industry in e-bidding, public sector and large private clients would need to take leadership by making bidder's capability for e-bidding and e-project management at all project phases a criteria in bid evaluation. E-bidding developers and promoters need to use test project cases to monitor, measure, and document the benefits of e-bidding. To disseminate the perceived benefits, promoters would need to work closely with industry professional associations to develop promotional programmes linked to continuous professional development (CPD) points. The analytical approach used in this study should assist other researchers who might wish to address a similar research problem under a similar data and model constraints. (C) 2010 Elsevier B.V. All rights reserved.	[Aibinu, Ajibade Ayodeji; Al-Lawati, Ahmed Murtadha] Univ Melbourne, Fac Architecture Bldg & Univ, Melbourne Sch Design, Parkville, Vic 3010, Australia	Aibinu, AA (corresponding author), Univ Melbourne, Fac Architecture Bldg & Univ, Melbourne Sch Design, Parkville, Vic 3010, Australia.	aaibinu@unimelb.edu.au; allawati141@google.com	Ajibade, Aibinu/D-2635-2017	Ajibade, Aibinu/0000-0001-6896-1682				54	104	104	1	77	ELSEVIER	AMSTERDAM	RADARWEG 29, 1043 NX AMSTERDAM, NETHERLANDS	0926-5805	1872-7891		AUTOMAT CONSTR	Autom. Constr.	OCT	2010	19	6					714	724		10.1016/j.autcon.2010.02.016			11	Construction & Building Technology; Engineering, Civil	Construction & Building Technology; Engineering	645CG	WOS:000281427900006					2021-12-21	
J	PREDPALL, DF				PREDPALL, DF			DEVELOPING QUALITY-IMPROVEMENT PROCESSES IN CONSULTING ENGINEERING FIRMS	JOURNAL OF MANAGEMENT IN ENGINEERING			English	Article								The New York metropolitan offices operating unit of Woodward-Clyde Consultants has been implementing a quality improvement process since late in 1991. After a six-month period in which the awareness of quality management was discussed in the 130-person operation, a quality-improvement committee was formed. The committee supported the formation of quality action teams, whose purpose was to improve certain processes initially identified by the employees. As the client feedback system is implemented, opportunities for process improvement come from clients as well. All employees are receiving training in the scientific method of problem solving (including systems theory) as well as the more philosophical and behavioral aspects of quality (i.e., profound knowledge as Deming calls it). In the first 24 months of this quality effort, several positive results have been seen: employee turnover has decreased; employee morale has improved; and clients have provided useful feedback.		PREDPALL, DF (corresponding author), WOODWARD CLYDE CONSULTANTS,201 WILLOWBROOK BLVD,WAYNE,NJ 07470, USA.							9	1	1	0	3	ASCE-AMER SOC CIVIL ENG	NEW YORK	345 E 47TH ST, NEW YORK, NY 10017-2398	0742-597X			J MANAGE ENG	J. Manage. Eng.	MAY-JUN	1994	10	3					28	34		10.1061/(ASCE)9742-597X(1994)10:3(28)			7	Engineering, Industrial; Engineering, Civil	Engineering	QB014	WOS:A1994QB01400013					2021-12-21	
J	Sterner, E				Sterner, E			Life-cycle costing and its use in the Swedish building sector	BUILDING RESEARCH AND INFORMATION			English	Article						building economics; life cycle costing; building operation; maintenance; clients; procurement; green building; Sweden		The results from a survey examing the extent that Swedish clients in the building sector use life-cycle cost (LCC) estimations are reported. The limits and benefits from the client and user perspectives are also explored. The interest in using LCC approaches for economic evaluation of investment decisions is large. However, constraints exists at a number of levels: uncertainties related to the long term forecasts used, difficulties in achieving relevant input data and lack of experience in using LCC models, incentives for consultants and contractors. Nonetheless, the LCC perspective is proving to be most useful during the design phase where the possibilities of cost reductions related to operation and maintenance are large. LCC can provide motivation for environmental progressive building despite the sometime higher initial cost. The implication for expanding the use of LCC are considered for government, clients/developers, professionals.	Lulea Univ Technol, Dept Civil & Min Engn, Lulea, Sweden	Sterner, E (corresponding author), Lulea Univ Technol, Dept Civil & Min Engn, Lulea, Sweden.							10	51	51	0	15	E & FN SPON	LONDON	2-6 BOUNDARY ROW, LONDON SE1 8HN, ENGLAND	0961-3218			BUILD RES INF	Build. Res. Informat.	SEP	2000	28	5-6					387	393		10.1080/096132100418537			7	Construction & Building Technology	Construction & Building Technology	355AY	WOS:000089364500009					2021-12-21	
J	Shoura, MM; Singh, A				Shoura, MM; Singh, A			System interrelations of organizational variables	JOURNAL OF MANAGEMENT IN ENGINEERING			English	Article								This paper studies some of the organizational variables in project management. It is shown that only a few variables have a significant direct impact on the management system. The paper focuses on system variables in the emerging modem engineering and technology-based medium- and large-sized organizations such as contracting firms, consultants, developers, and the U.S. Army. This paper studies the interrelations among the system variables and their total effect on the management system. It examines the organizational system through a study of organizational variables-planning measures, power bases, conflict management, role pressures, organizational structure, team management, and strategies for success. It establishes that three variables-planning measures, team management, and strategies for success-have higher relevance than others in the complex environment of organizational variable interrelationships. Their higher significance on the management system makes them both important and sensitive. Other variables affect the system directly to a lesser degree, and indirectly through their interrelation with the most relevant three.	UNIV HAWAII MANOA,DEPT CIVIL ENGN,HONOLULU,HI 96822	Shoura, MM (corresponding author), GMP ASSOC INC,HONOLULU,HI 96813, USA.							13	2	2	0	2	ASCE-AMER SOC CIVIL ENGINEERS	NEW YORK	345 E 47TH ST, NEW YORK, NY 10017-2398	0742-597X			J MANAGE ENG	J. Manage. Eng.	JAN-FEB	1997	13	1					67	79		10.1061/(ASCE)0742-597X(1997)13:1(67)			13	Engineering, Industrial; Engineering, Civil	Engineering	VZ149	WOS:A1997VZ14900030					2021-12-21	
J	Karna, S; Junnonen, JM				Karna, Sami; Junnonen, Juha-Matti			Designers' performance evaluation in construction projects	ENGINEERING CONSTRUCTION AND ARCHITECTURAL MANAGEMENT			English	Article						Project management; Customer satisfaction; Performance measures; Design management; Critical success factors; Project participants satisfaction	CRITICAL SUCCESS FACTORS; SATISFACTION; QUALITY	Purpose - In a construction project, "participants' satisfaction" is one of the main dimensions used for measuring the successfulness of a project. Designers perform a major role in attaining the project goals and managing project complexity during production. The purpose of this paper is to examine the designers' performance as evaluated by the main participants: the client, the project consultant/manager and the main contractor, and to identify the main success factors of designer performance using the participants' evaluation. The study also aims to examine how the economic size of a project affects the project participants' assessment of the designer's performance. It is assumed that as the size of a project increases, so does the complexity of the project, which will affect the scope of work and demands on the designers' operational performance for the specific project level. Design/methodology/approach - The Finnish project evaluation and benchmark database was used in this study as empirical data. The quantitative data consists of surveys on the project level and are based on a multi-dimensional standard evaluation wherein the main participants evaluate each other's performances. The client, project consultant and main contractor evaluated the designer's performance. The data of the study consisted of a total of 892 evaluations. ANOVA analysis was used to examine the differences between the project participants' assessments based upon the different economic sizes of the projects. Findings - Contractors were satisfied with the designers' performance in small projects, whereas the client and the project consultant/manager rated the designers' performance most successful in large projects. This result may be due to small projects are typically simple and less complex, in which case design solutions are generally well-defined. Nonetheless, the participants' level of satisfaction follows the same factors. The main problems in the designers' performance were related to the design content: the flawlessness and comprehensiveness, as well as the compatibility and consistency of designs. These factors were emphasized particularly in the client's low satisfaction of the designer's performance. However, project participants were satisfied with the collaboration with designers; however, room for improvement could be found in internal communication and collaboration within the design teams. The findings illustrated that the assessment of the success rate of a project was party-specific, which was clearly affected by the size of the project, as large projects appeared to be more complex than smaller ones. Practical implications - The findings suggested that there is a need to develop project-specific practices in managing multidisciplinary design teams. Additionally, particularly in large projects, designers should focus more on solving problems and design requirements occurring at the construction site. However, this should be implemented in such a way that this does not interfere with the design activities conducted with the client and project management. While client satisfaction is low in the small projects, designers should focus more on customer-oriented methods to serve client needs better. Originality/value - In construction project management studies, there is a need to measure the importance that various participants assign to different success factors. Since project success factors depend on project type, a more project-specific approach is suggested to identify the main parameters for measuring project success. This study provides a holistic approach of the designers' performance, which contributes to the theory of project success and designers' performance improvement.	[Karna, Sami; Junnonen, Juha-Matti] Aalto Univ, Espoo, Finland	Karna, S (corresponding author), Aalto Univ, Espoo, Finland.	sami.karna@aalto.fi		Junnonen, Juha-Matti Kalevi/0000-0001-7538-8386	Finnish Construction Quality Association (RALA)	The authors wish to thank Finnish Construction Quality Association (RALA) for their support and collaboration for the reported study.		51	18	18	1	24	EMERALD GROUP PUBLISHING LTD	BINGLEY	HOWARD HOUSE, WAGON LANE, BINGLEY BD16 1WA, W YORKSHIRE, ENGLAND	0969-9988	1365-232X		ENG CONSTR ARCHIT MA	Eng. Constr. Archit. Manag.		2017	24	1					154	169		10.1108/ECAM-06-2015-0101			16	Engineering, Industrial; Engineering, Civil; Management	Engineering; Business & Economics	EM8XI	WOS:000395594000009					2021-12-21	
J	Zimring, C; Khan, S; Craig, D; Haq, SU; Guzdial, M				Zimring, C; Khan, S; Craig, D; Haq, SU; Guzdial, M			CoOL Studio: using simple tools to expand the discursive space of the design studio	AUTOMATION IN CONSTRUCTION			English	Article						design; design education; virtual studio; on-line education; collaboration; computer tools; design studio; architecture; architectural design; asynchronous collaboration	COMPUTER	Collaborative On-line Studio for Architecture (CoOL Studio) was aimed at aiding the architecture studio by: (1) supporting input by distant critics; (2) providing access to on-line cases and reference materials; (3) encouraging students to be clear and articulate about their projects; (4) supporting collaboration among students. The project employed a Collaborative Website (CoWeb), which allowed easy creation and modification of webpages without any security measures. Students posted their designs at several points during the term and six distant expert consultants provided critiques. This project demonstrates that a relatively simple representation tool, one that allowed students and critics to interact on editable webpages, can usefully open up the design space of the architecture studio. However, care is needed in understanding how computer tools relate to the tasks and rituals of interaction that go on in everyday architecture studio pedagogy. (C) 2001 Elsevier Science B.V. All rights reserved.	Georgia Inst Technol, Coll Architecture, Atlanta, GA 30332 USA; Georgia Inst Technol, Coll Comp, Atlanta, GA 30332 USA	Zimring, C (corresponding author), Georgia Inst Technol, Coll Architecture, 245 4th St, Atlanta, GA 30332 USA.			Guzdial, Mark/0000-0003-4427-9763; Haq, Saif/0000-0002-9790-975X				8	13	13	2	2	ELSEVIER SCIENCE BV	AMSTERDAM	PO BOX 211, 1000 AE AMSTERDAM, NETHERLANDS	0926-5805			AUTOMAT CONSTR	Autom. Constr.	AUG	2001	10	6					675	685		10.1016/S0926-5805(00)00092-3			11	Construction & Building Technology; Engineering, Civil	Construction & Building Technology; Engineering	467NC	WOS:000170709800004					2021-12-21	
J	FUNK, JL				FUNK, JL			JAPANESE PRODUCT-DEVELOPMENT STRATEGIES - A SUMMARY AND PROPOSITIONS ABOUT THEIR IMPLEMENTATION	IEEE TRANSACTIONS ON ENGINEERING MANAGEMENT			English	Article							TECHNOLOGICAL DISCONTINUITIES	This paper summarizes the current literature on Japanese product development strategies such as multifunctional problem solving, close relationships with suppliers and customers, incremental improvement, and learning and it develops several propositions about how Japanese firms might be implementing these strategies differently than U.S. firms. It uses a detailed case study of Mitsubishi's Semiconductor Equipment Department, published material on Japanese and U.S. product development methods and organization structure, a second case study of Yokogawa Electric, and the author's experience as an internal consultant for a large U.S. manufacturing firm to develop these propositions. These sources suggest that Japanese firms are implementing these strategies using a unique combination of organic and mechanistic mechanisms. Japanese organizational characteristics, such as open offices, product-oriented organizations, and decentralized decision making, suggest a more organic method of implementation while characteristics such as high levels of formalization, detailed schedules, and elaborate temporal and spatial office structures suggest a more mechanistic method of implementation than are used by U.S. firms.		FUNK, JL (corresponding author), PENN STATE UNIV,SMEAL COLL BUSINESS,UNIV PK,PA 16802, USA.							52	15	16	0	29	IEEE-INST ELECTRICAL ELECTRONICS ENGINEERS INC	NEW YORK	345 E 47TH ST, NEW YORK, NY 10017-2394	0018-9391			IEEE T ENG MANAGE	IEEE Trans. Eng. Manage.	AUG	1993	40	3					224	236		10.1109/17.233184			13	Business; Engineering, Industrial; Management	Business & Economics; Engineering	LX488	WOS:A1993LX48800002					2021-12-21	
J	Khlaifat, DM; Alyagoub, RE; Sweis, RJ; Sweis, GJ				Khlaifat, Duaa M.; Alyagoub, Reem E.; Sweis, Rateb J.; Sweis, Ghaleb J.			Factors leading to construction projects' failure in Jordon	INTERNATIONAL JOURNAL OF CONSTRUCTION MANAGEMENT			English	Article						Jordanian construction industry; project failure; construction projects; Drewin's Open Conversion System	COST OVERRUNS; DELAY FACTORS; MANAGEMENT	The construction industry is contemplated as one of the most essential and supportive pillars of the business environment in Jordan. Notwithstanding, the construction industry continues to struggle to achieve higher levels of success. An increasing number of projects in the construction industry have failed. However, research on the causes of failure is scarce. Thus, this study aims to identify the main factors and causes for construction projects' failure in Jordan. To fulfil the study objectives, 50 factors were recognized through a literature review and were categorized referring to Drewin's Open Conversion System; the most widely identified factors were assessed using complied data in a survey of construction industry contractors, consultant engineers and clients, and senior experts' interviews in the sector. The results show that major factors leading to construction projects' failure are related to the internal hierarchy of the system, especially that of the contractor.	[Khlaifat, Duaa M.; Alyagoub, Reem E.; Sweis, Ghaleb J.] Univ Jordan, Fac Engn & Technol, Civil Engn Dept, Amman, Jordan; [Sweis, Rateb J.] Univ Jordan, Business Management Coll, Amman, Jordan	Khlaifat, DM (corresponding author), Univ Jordan, Fac Engn & Technol, Civil Engn Dept, Amman, Jordan.	Reemrabadi@rocketmail.com	Sweis, Rateb/AAU-4858-2021	Sweis, Rateb/0000-0002-8924-2334; Sweis, Ghaleb/0000-0001-6979-6420	Deanship of Academic Research, University of Jordan [1354]	Deanship of Academic Research, University of Jordan [grant number 1354]		52	7	7	0	7	TAYLOR & FRANCIS LTD	ABINGDON	2-4 PARK SQUARE, MILTON PARK, ABINGDON OR14 4RN, OXON, ENGLAND	1562-3599	2331-2327		INT J CONSTR MANAG	Int. J. Constr. Manag.	JAN 2	2019	19	1					65	78		10.1080/15623599.2017.1382092			14	Management	Business & Economics	HE5ZI	WOS:000453476500006					2021-12-21	
