PT	AU	BA	BE	GP	AF	BF	CA	TI	SO	SE	BS	LA	DT	CT	CY	CL	SP	HO	DE	ID	AB	C1	RP	EM	RI	OI	FU	FX	CR	NR	TC	Z9	U1	U2	PU	PI	PA	SN	EI	BN	J9	JI	PD	PY	VL	IS	PN	SU	SI	MA	BP	EP	AR	DI	D2	EA	PG	WC	SC	GA	UT	PM	OA	HC	HP	DA
J	Wang, C; Cho, YK; Gai, MM				Wang, Chao; Cho, Yong K.; Gai, Mengmeng			As-Is 3D Thermal Modeling for Existing Building Envelopes Using a Hybrid LIDAR System	JOURNAL OF COMPUTING IN CIVIL ENGINEERING			English	Article						Three-dimensional models; Cameras; Decision support systems; Building envelope; Commercial buildings; Thermal factors; 3D modeling; Point cloud; LIDAR; IR camera; Building energy; Decision support		This paper introduces a hybrid method for rapidly measuring thermal data and three-dimensional (3D) geometries of buildings, allowing virtual representations of the energy and environmental performance of existing buildings. The 3D thermal models can be further used for many applications by building occupants, owners, and outside consultants to make retrofit decisions. Existing buildings represent the greatest opportunity to improve building energy efficiency and reduce environmental impacts. This research aims to help decision makers improve their buildings by providing reliable, visual information about their buildings' energy performance using the developed hybrid light detection and ranging (LIDAR) system. The 3D thermal model described consists of point clouds of building geometry with thermal data on each point, including temperature values (degrees C) and thermal color generated on the basis of the temperature value. Window detection algorithms were developed in this study to create virtual thermal points on window glasses because a LIDAR system is unable to collect geometric data from transparent objects. The system's technical feasibility has been successfully demonstrated through intensive lab and field experiments on residential and small commercial buildings. (C) 2013 American Society of Civil Engineers.	[Wang, Chao; Cho, Yong K.] Georgia Inst Technol, Sch Civil & Environm Engn, Atlanta, GA 30332 USA; [Gai, Mengmeng] Univ Nebraska Lincoln, Coll Engn, Charles Durham Sch Architectural Engn & Construct, Omaha, NE 68182 USA	Cho, YK (corresponding author), Georgia Inst Technol, Sch Civil & Environm Engn, Atlanta, GA 30332 USA.	cwang2@gatech.edu; yong.cho@ce.gatech.edu; mengmeng.gai@gmail.com			U.S. Department of EnergyUnited States Department of Energy (DOE) [DE-EE0001690]; National Science Foundation (NSF)National Science Foundation (NSF) [CMMI-1055788]	This material is based on work supported by the U.S. Department of Energy (Contract # DE-EE0001690) and supported in part by the National Science Foundation (NSF) (Award # CMMI-1055788). Any opinions, findings, and conclusions or recommendations expressed in this material are those of the authors and do not necessarily reflect the views of the U. S. DOE and the NSF.		23	46	46	1	17	ASCE-AMER SOC CIVIL ENGINEERS	RESTON	1801 ALEXANDER BELL DR, RESTON, VA 20191-4400 USA	0887-3801	1943-5487		J COMPUT CIVIL ENG	J. Comput. Civil. Eng.	NOV 1	2013	27	6					645	656		10.1061/(ASCE)CP.1943-5487.0000273			12	Computer Science, Interdisciplinary Applications; Engineering, Civil	Computer Science; Engineering	234LR	WOS:000325646200008					2021-12-21	
J	d'Amato, M; Kauko, T				d'Amato, Maurizio; Kauko, Tom			Sustainability and risk premium estimation in property valuation and assessment of worth	BUILDING RESEARCH AND INFORMATION			English	Article						buildings; discount cash flow (DCF); property valuation; risk premium; sustainability; value	FUNCTIONAL FORM; CHOICE; MARKET; EQUILIBRIUM	From a risk analysis perspective, property is typically treated as just another asset class. Some academics propose only a financial - not a physical or a functional - definition of valuation modelling. An alternative method is proposed here to assess the risk premium for both property valuation and assessment of worth which is directly based on the property market, rather than the traditional financial model of risk premium determination or reliance on the individual expertise of a property valuer. The proposed method is based on the empirical relationship between discount cash flow (DCF) inputs and output, and can be based on the prices of comparable properties. In the traditional approach, the fact that financial modelling approximates real property to a financial asset class arguably emphasizes the illiquid nature of real property. As a consequence, all the attributes including sustainability indicators are normally not taken into account by property valuers and consultants. The market increasingly requires green buildings and development; through the use of the proposed model this need can be included in the data for risk premium estimation, in the valuation process, and, generally speaking, in the body of knowledge informing the property market.	[d'Amato, Maurizio] Tech Univ Politecn Bari, Fac Engn, I-70122 Bari, Italy; [Kauko, Tom] Norwegian Univ Sci & Technol NTNU, Dept Geog, N-7491 Trondheim, Norway	d'Amato, M (corresponding author), Tech Univ Politecn Bari, Fac Engn, Via Calefati 272, I-70122 Bari, Italy.	madamato@interfree.it; tom.kauko@svt.ntnu.no	D'amato, Maurizio/Q-8590-2018	D'amato, Maurizio/0000-0002-6719-9056				58	24	24	0	15	ROUTLEDGE JOURNALS, TAYLOR & FRANCIS LTD	ABINGDON	2-4 PARK SQUARE, MILTON PARK, ABINGDON OX14 4RN, OXON, ENGLAND	0961-3218	1466-4321		BUILD RES INF	Build. Res. Informat.		2012	40	2					174	185		10.1080/09613218.2012.655069			12	Construction & Building Technology	Construction & Building Technology	911FU	WOS:000301703500004					2021-12-21	
J	Awad, A; Fayek, AR				Awad, Adel; Fayek, Aminah Robinson			A decision support system for contractor prequalification for surety bonding	AUTOMATION IN CONSTRUCTION			English	Article						Prequalification; Bonding; Expert systems; Fuzzy logic; Surety underwriting	SELECTION CRITERIA; CONSTRUCTION; MODEL	In the construction bonding business, a complex and comprehensive prequalification or assessment process is done to evaluate contractor, project, and contractual risks. Previous studies have focused mainly on contractor prequalification from the owner's or consultant's perspective. There remains a need for a model to evaluate the contractor and project-specific aspects (i.e., project team and contractual risks) from the surety bonding perspective. This paper identifies and classifies the most relevant evaluation criteria that surety underwriters and brokers consider when evaluating a specific construction project for bonding purposes. Several data collection techniques (questionnaires, one-on-one interviews, and interacting group meetings), with highly experienced surety experts, were conducted to compile a comprehensive and detailed list of the evaluation criteria. Both fuzzy logic and expert systems are combined to develop a decision support system (DSS) for use in contractor and project evaluation. An approach for fuzzy membership function estimation is presented using a traditional membership function estimation technique, integrated with data of contractor prequalification cases. Thirty-eight alternative system configurations are investigated to determine the most accurate one. The system is validated using 32 prequalification cases, and the accuracy of the system is found to be 84.0%. (C) 2011 Elsevier B.V. All rights reserved.	[Awad, Adel; Fayek, Aminah Robinson] Univ Alberta, Hole Sch Construct Engn, Dept Civil & Environm Engn, Edmonton, AB T6G 2W2, Canada	Fayek, AR (corresponding author), Univ Alberta, Hole Sch Construct Engn, Dept Civil & Environm Engn, 3-013 Markin CNRL Nat Resources Engn Facil, Edmonton, AB T6G 2W2, Canada.	alawad@ualberta.ca; aminah.robinson@ualberta.ca	Fayek, Aminah Robinson/AAA-2461-2019	Fayek, Aminah Robinson/0000-0002-3744-273X				48	19	20	0	38	ELSEVIER	AMSTERDAM	RADARWEG 29, 1043 NX AMSTERDAM, NETHERLANDS	0926-5805	1872-7891		AUTOMAT CONSTR	Autom. Constr.	JAN	2012	21						89	98		10.1016/j.autcon.2011.05.017			10	Construction & Building Technology; Engineering, Civil	Construction & Building Technology; Engineering	873OW	WOS:000298893700010					2021-12-21	
J	Chau, KW; Albermani, F				Chau, KW; Albermani, F			A coupled knowledge-based expert system for design of liquid-retaining structures	AUTOMATION IN CONSTRUCTION			English	Article						coupled knowledge-based expert system; design; liquid-retaining structures	FLOW	This paper describes a coupled knowledge-based system (KBS) for the design of liquid-retaining structures, which can handle both the symbolic knowledge processing based on engineering heuristics in the preliminary synthesis stage and the extensive numerical crunching involved in the detailed analysis stage. The prototype system is developed by employing blackboard architecture and a commercial shell VISUAL RULE STUDIO. Its present scope covers design of three types of liquid-retaining structures, namely, a rectangular shape with one compartment, a rectangular shape with two compartments and a circular shape. Through custom-built interactive graphical user interfaces, the user is directed throughout the design process, which includes preliminary design, load specification, model generation, finite element analysis, code compliance checking and member sizing optimization. It is also integrated with various relational databases that provide the system with sectional properties, moment and shear coefficients and final member details. This system can act as a consultant to assist novice designers in the design of liquid-retaining structures with increase in efficiency and optimization of design output and automated record keeping. The design of a typical example of the liquid-retaining structure is also illustrated. (C) 2003 Elsevier B.V All rights reserved.	Hong Kong Polytech Univ, Dept Civil & Struct Engn, Kowloon, Hong Kong, Peoples R China; Univ Queensland, Dept Civil Engn, Brisbane, Qld 4072, Australia	Chau, KW (corresponding author), Hong Kong Polytech Univ, Dept Civil & Struct Engn, Kowloon, Hong Kong, Peoples R China.		Albermani, Faris/AAB-1172-2020; Chau, Kwok-wing/E-5235-2011	Albermani, Faris/0000-0001-8540-1724; Chau, Kwok-wing/0000-0001-6457-161X				16	11	12	0	6	ELSEVIER SCIENCE BV	AMSTERDAM	PO BOX 211, 1000 AE AMSTERDAM, NETHERLANDS	0926-5805			AUTOMAT CONSTR	Autom. Constr.	SEP	2003	12	5					589	602		10.1016/S0926-5805(03)00041-4			14	Construction & Building Technology; Engineering, Civil	Construction & Building Technology; Engineering	725JW	WOS:000185536400015		Green Submitted			2021-12-21	
J	Abdelaty, A; Shrestha, KJ; Jeong, HD				Abdelaty, Ahmed; Shrestha, K. Joseph; Jeong, H. David			Estimating Preconstruction Services for Bridge Design Projects	JOURNAL OF MANAGEMENT IN ENGINEERING			English	Article						Preliminary-cost estimating; Design-cost estimating; Case-based reasoning	NEURAL-NETWORK; COST-ESTIMATION; MODEL	Preconstruction services play a vital role in ensuring timely approval of infrastructure funds and successful execution of construction projects. Most state DOTs use simple methods such as a percentage of estimated construction costs that has proven to be unreliable. Several studies have developed statistical models using historical data to improve current practices. However, such models have performed poorly, and practitioners have not utilized these models. This study develops and evaluates data mining models such as multiple regression and artificial neural networks and concludes that such models do not provide sufficiently accurate estimates of preconstruction service fees and hours. Subsequently, it proposes an alternative approach using a case-based reasoning (CBR) technique that uses similarity scoring to retrieve the most similar projects. The historical preconstruction service fees and hours of similar projects can be used to estimate preconstruction service fees and hours for a new project and make any adjustment necessary. A spreadsheet tool is developed to implement this CBR technique. The tool provides a simple and flexible platform that enables engineers to extract necessary data and help them in making data-driven estimates. Thus, the tool is expected to aid state DOT engineers in negotiating with consultants with higher confidence.	[Abdelaty, Ahmed] Southern Illinois Univ, Dept Construct, Edwardsville, IL 62026 USA; [Shrestha, K. Joseph] East Tennessee State Univ, Dept Engn Engn Technol & Surveying, Johnson City, TN 37614 USA; [Jeong, H. David] Texas A&M Univ, Dept Construct Sci, College Stn, TX 77845 USA	Abdelaty, A (corresponding author), Southern Illinois Univ, Dept Construct, Edwardsville, IL 62026 USA.	ahahmed@siue.edu; shresthak@etsu.edu; djeong@tamu.edu		Jeong, Hyungseok/0000-0003-4074-1869	Iowa Highway Research Board	The authors would like to acknowledge the Iowa Highway Research Board for sponsoring this research as well as their input and feedback.		28	3	3	5	42	ASCE-AMER SOC CIVIL ENGINEERS	RESTON	1801 ALEXANDER BELL DR, RESTON, VA 20191-4400 USA	0742-597X	1943-5479		J MANAGE ENG	J. Manage. Eng.	JUL 1	2020	36	4							04020034	10.1061/(ASCE)ME.1943-5479.0000793			11	Engineering, Industrial; Engineering, Civil	Engineering	LS0ZA	WOS:000536120800018					2021-12-21	
J	Ozorhon, B; Cinar, E				Ozorhon, Beliz; Cinar, Emrah			Critical Success Factors of Enterprise Resource Planning Implementation in Construction: Case of Turkey	JOURNAL OF MANAGEMENT IN ENGINEERING			English	Article						Enterprise resource planning; Critical success factors; Construction industry	SYSTEMS SUCCESS; ERP SYSTEM; PROJECTS; MODEL; LESSONS	Construction is considered as one of the highly fragmented, inefficient, and low-performing industries. Enterprise resource planning (ERP) systems have been used to overcome such problems. However, due to a number of technical and organizational barriers, ERP implementation is very challenging. The major objective of the research reported in this paper is to explore the critical success factors (CSFs) of ERP implementation in the construction industry in developing countries. In this respect, based on an extensive literature review, 14 CSFs were identified and a questionnaire survey was conducted to analyze the role of those CSFs on the performance of ERP implementation. The data is collected from 90 construction firms from Turkey. The statistical analysis results show that top management support and commitment, clear goals and objectives, project team competence, effectiveness of the project leader, and cooperation between team members are the most significant drivers of success. Factor analysis was also employed on the data and the findings suggest three dimensions, namely (1) human factors, (2) organization, and (3) technology. Findings of the research reported in this paper are expected to help senior managers and consultants implement ERP systems in construction firms in an effective manner. (C) 2015 American Society of Civil Engineers.	[Ozorhon, Beliz; Cinar, Emrah] Bogazici Univ, Dept Civil Engn, TR-34342 Istanbul, Turkey	Ozorhon, B (corresponding author), Bogazici Univ, Dept Civil Engn, TR-34342 Istanbul, Turkey.	beliz.ozorhon@boun.edu.tr; emrahc@boun.edu.tr	Ozorhon, Beliz/H-7788-2015	Ozorhon, Beliz/0000-0002-4963-6937				58	14	14	0	75	ASCE-AMER SOC CIVIL ENGINEERS	RESTON	1801 ALEXANDER BELL DR, RESTON, VA 20191-4400 USA	0742-597X	1943-5479		J MANAGE ENG	J. Manage. Eng.	NOV	2015	31	6							4015014	10.1061/(ASCE)ME.1943-5479.0000370			8	Engineering, Industrial; Engineering, Civil	Engineering	CT8TG	WOS:000363088800029					2021-12-21	
J	Vukomanovic, M; Radujkovic, M; Nahod, MM				Vukomanovic, Mladen; Radujkovic, Mladen; Nahod, Maja Marija			EFQM EXCELLENCE MODEL AS THE TQM MODEL OF THE CONSTRUCTION INDUSTRY OF SOUTHEASTERN EUROPE	JOURNAL OF CIVIL ENGINEERING AND MANAGEMENT			English	Article						EFQM excellence model; validation; total quality management; factor analysis; the construction industry	PERFORMANCE-MEASUREMENT; ORGANIZATIONAL QUALITY; MANAGEMENT; FRAMEWORK; BALDRIGE; IMPLEMENTATION; CRITERIA; IMPACT; SATISFACTION; FIRM	Over the years the European Foundation for Quality Management Excellence model (EFQM) has become a popular performance management tool and representation of Total Quality Management (TQM) in Europe. Although the model has been tested and supported by many questionnaire surveys, EFQM has never been validated on real self-assessment scores obtained from companies. Therefore this study validates the model on scores from 34 construction companies in South Eastern Europe. The analysis shows that: a) there is an enabler excellence construct that is obtained by each enabler criteria; b) there is a result excellence construct that is obtained by each result criteria; and c) the EFQM model is most suitable for Contractor type organizations. Furthermore, we have found that the EFQM weights do not entirely correspond with the construction industry. Therefore we present new weights for the better use in the construction. Although this study proves EFQM to be a good representation of TQM in the construction industry, further improvements are needed. This is especially evident within investor and consultant type organization, where the criteria of Policy and Strategy, Leadership and Processes, People results and Client results showed certain limitations.	[Vukomanovic, Mladen; Radujkovic, Mladen; Nahod, Maja Marija] Univ Zagreb, Fac Civil Engn, HR-10002 Zagreb, Croatia	Vukomanovic, M (corresponding author), Univ Zagreb, Fac Civil Engn, Kaciceva 26, HR-10002 Zagreb, Croatia.	mvukoman@grad.hr	Nahod, Maja-Marija/G-2405-2015	Nahod, Maja-Marija/0000-0002-1785-3128				82	12	12	0	34	VILNIUS GEDIMINAS TECH UNIV	VILNIUS	SAULETEKIO AL 11, VILNIUS, LT-10223, LITHUANIA	1392-3730	1822-3605		J CIV ENG MANAG	J. Civ. Eng. Manag.	FEB	2014	20	1					70	81		10.3846/13923730.2013.843582			12	Engineering, Civil	Engineering	AD0KA	WOS:000332921700008		hybrid			2021-12-21	
J	Yap, JBH; Chong, JR; Skitmore, M; Lee, WP				Yap, Jeffrey Boon Hui; Rou Chong, Jia; Skitmore, Martin; Lee, Wah Peng			Rework Causation that Undermines Safety Performance during Production in Construction	JOURNAL OF CONSTRUCTION ENGINEERING AND MANAGEMENT			English	Article						Rework; Safety; Causes; Construction; Project management; Factor analysis	OCCUPATIONAL INJURIES; DEVELOPING-COUNTRIES; PROJECTS; IMPACT; ACCIDENTS; MANAGEMENT; INDUSTRY; CLIMATE; COSTS; FATIGUE	Rework is positively linked with increased safety risks. As a precursor to decreased rework and enhanced safety performance, this study appraised the correlative causes of rework and safety incidents. To do this, 20 rework causes that undermine safety performance were first identified through the literature review. Using a survey questionnaire involving Malaysian construction professionals (owners, consultants, and contractors), the causes were prioritized based on frequency, severity, and importance indices. The five leading rework-safety causes were ranked as follows: poor coordination, insufficient communication, poor subcontractor management, improper supervision and inspection, and poor site management. Spearman's rank correlation tests revealed a significant agreement between the respondent groups. An exploratory factor analysis identified the five major underlying causal dimensions of rework and safety incidents to relate to the substandard management of equipment and machinery, poor project management practices, inherent dangerous, dirty, and difficult (3D) characteristics, improper production planning and work pressure, and inadequate personnel competency and knowledge. This paper bridges the identified knowledge gap concerning the dimensionality of rework and accident causation in construction, and the findings provide guidance for devising preventive measures for simultaneously addressing rework and safety problems. (C) 2020 American Society of Civil Engineers.	[Yap, Jeffrey Boon Hui; Rou Chong, Jia; Lee, Wah Peng] Univ Tunku Abdul Rahman, Lee Kong Chian Fac Engn & Sci, Kajang 43000, Malaysia; [Skitmore, Martin] Queensland Univ Technol, Sch Built Environm, Brisbane, Qld 4000, Australia	Yap, JBH (corresponding author), Univ Tunku Abdul Rahman, Lee Kong Chian Fac Engn & Sci, Kajang 43000, Malaysia.	bhyap@utar.edu.my; jrjang9611@gmail.com; rm.skitmore@qut.edu.au; leewp@utar.edu.my		Wah Peng, Lee/0000-0001-9177-5415; Skitmore, Martin/0000-0001-7135-1201; Yap, Jeffrey Boon Hui/0000-0003-4332-0031	Universiti Tunku Abdul Rahman Research Fund (UTARRF) [IPSR/RMC/UTARRF/2019-C2/J01]	This work was supported by the Universiti Tunku Abdul Rahman Research Fund (UTARRF) (Project No. IPSR/RMC/UTARRF/2019-C2/J01).		93	11	11	7	15	ASCE-AMER SOC CIVIL ENGINEERS	RESTON	1801 ALEXANDER BELL DR, RESTON, VA 20191-4400 USA	0733-9364	1943-7862		J CONSTR ENG M	J. Constr. Eng. Manage.	SEP 1	2020	146	9							04020106	10.1061/(ASCE)CO.1943-7862.0001902			14	Construction & Building Technology; Engineering, Industrial; Engineering, Civil	Construction & Building Technology; Engineering	PU7AD	WOS:000609451500014		Green Submitted			2021-12-21	
J	Lee, C; Lee, C; Lee, EB				Lee, Chijoo; Lee, Chiheyon; Lee, Eul-Bum			A METHOD FOR ANALYZING THE EFFECT OF IMPLEMENTING AN ENTERPRISE SYSTEM BASED ON THE COMPLEXITY OF ACTIVITIES	JOURNAL OF CIVIL ENGINEERING AND MANAGEMENT			English	Article						working time; workflow; activity; process; automation and digitalization	CRITICAL SUCCESS FACTORS; ERP IMPLEMENTATION; EFFICIENCY ANALYSIS; EMPIRICAL-EVIDENCE; CONSTRUCTION; PRODUCTIVITY; IMPACT; CUSTOMIZATION; PERFORMANCE; PROJECTS	This paper presents a method for analyzing the effect of implementing an enterprise system (ES) in the construction industry during the ES introduction and planning stages. The effect is a reduction in employees' work time. The proposed method is based on the 1) level of digitalized and automated activities, the 2) complexity of the activities, and the 3) complexity of the processes in the workflow. The method was applied at a construction company that has no enterprise resource planning (ERP), and the method's accuracy was evaluated by information technology consultants who have performed planning, construction, and operation in relation to ERP. The result shows that the effect of management business was the largest; most of this effect was on data management and review. After users became familiar with ERP, the reduction in data input time increased. The analysis method takes less time and costs less than using surveys to measure the work time and satisfaction of ES users. It can also identify processes in which the effect increases or decreases, thereby guiding any modifications of the ES before it is introduced.	[Lee, Chijoo] Yonsei Univ, Dept Architectural Engn, Seoul, South Korea; [Lee, Chiheyon] ALUX Co Ltd, Seoul, South Korea; [Lee, Eul-Bum] Pohang Univ Sci & Technol, Grad Inst Ferrous Technol, Pohang, South Korea; [Lee, Eul-Bum] Pohang Univ Sci & Technol, Grad Sch Engn Mastership, Pohang, South Korea	Lee, C (corresponding author), Yonsei Univ, Dept Architectural Engn, Seoul, South Korea.	news3749@gmail.com		Lee, Chijoo/0000-0003-1376-9380				54	0	0	1	8	VILNIUS GEDIMINAS TECH UNIV	VILNIUS	SAULETEKIO AL 11, VILNIUS, LT-10223, LITHUANIA	1392-3730	1822-3605		J CIV ENG MANAG	J. Civ. Eng. Manag.		2018	24	7					526	536		10.3846/jcem.2018.6130			11	Engineering, Civil	Engineering	HB7YV	WOS:000451299800003		gold, Green Published			2021-12-21	
