PT	AU	BA	BE	GP	AF	BF	CA	TI	SO	SE	BS	LA	DT	CT	CY	CL	SP	HO	DE	ID	AB	C1	RP	EM	RI	OI	FU	FX	CR	NR	TC	Z9	U1	U2	PU	PI	PA	SN	EI	BN	J9	JI	PD	PY	VL	IS	PN	SU	SI	MA	BP	EP	AR	DI	D2	EA	PG	WC	SC	GA	UT	PM	OA	HC	HP	DA
J	Illankoon, IMCS; Tam, VWY; Le, KN; Ranadewa, KATO				Illankoon, I. M. C. S.; Tam, Vivian W. Y.; Le, Khoa N.; Ranadewa, K. A. T. O.			Causes of disputes, factors affecting dispute resolution and effective alternative dispute resolution for Sri Lankan construction industry	INTERNATIONAL JOURNAL OF CONSTRUCTION MANAGEMENT			English	Article; Early Access						Alternative dispute resolution; construction industry; disputes; Sri Lanka	ADJUDICATION; SELECTION; PROJECTS; BOARDS	Construction industry is typically vital to the economy of any country. It appears that on-going large-scale building and infrastructure projects in Sri Lanka have attracted numerous international contractors. Moreover, in Sri Lanka, there are several foreign investors, and to-be-funded mega government projects at their inception and initial stages, increasing competition which has already been fierce. However, these massive projects under various stakeholders with different interests usually initiate conflicting claims, if not resolved, will likely lead to disputes, and filing law suits. Once a dispute is crystallized, there are commonly used alternative dispute resolution (ADR) mechanisms. However, the causes leading to the claims to form a dispute, and the effective ADR methods are largely dependent on the perspective of the stakeholders. This research aims to identifying those dispute causes, factors affecting the selection of dispute resolution methods, and the most effective ADR method in the perspective of different parties to construction projects in the Sri Lankan construction industry. First, an extensive literature review was carried out to identify the ADR context in Sri Lanka. Second, a comprehensive questionnaire survey was conducted involving professionals representing various stakeholders such as contractors, clients and consultants. Survey responses were then analyzed using special purpose statistical software (SPSS). To determine the statistical significance difference among stakeholders' perception, Kruskal-Wallis H test was used with a 90% confidence level. This research thus provides additional insights into causes of claims and ADR selection from different perspectives.	[Illankoon, I. M. C. S.] Univ Newcastle, Sch Architecture & Built Environm, Newcastle, NSW, Australia; [Tam, Vivian W. Y.; Le, Khoa N.] Western Sydney Univ, Sch Comp Engn & Math, Penrith, NSW, Australia; [Tam, Vivian W. Y.] Shenzhen Univ, Coll Civil Engn, Shenzhen, Peoples R China; [Ranadewa, K. A. T. O.] Univ Moratuwa, Dept Bldg Econ, Moratuwa, Sri Lanka	Tam, VWY (corresponding author), Western Sydney Univ, Sch Comp Engn & Math, Penrith, NSW, Australia.; Tam, VWY (corresponding author), Shenzhen Univ, Coll Civil Engn, Shenzhen, Peoples R China.	V.Tam@westernsydney.edu.au	Illankoon, Chethana/AAS-3700-2020	Tam, Vivian/0000-0002-1074-8018; Illankoon, I.M. Chethana S./0000-0002-4524-8785	Australian Research Council (ARC), Australian GovernmentAustralian Research Council [DP150101015, DP190100559]	The authors wish to acknowledge the financial support of the Australian Research Council (ARC), Australian Government, under the Discovery Project DP150101015 and DP190100559.		42	6	6	6	25	TAYLOR & FRANCIS LTD	ABINGDON	2-4 PARK SQUARE, MILTON PARK, ABINGDON OR14 4RN, OXON, ENGLAND	1562-3599	2331-2327		INT J CONSTR MANAG	Int. J. Constr. Manag.												10.1080/15623599.2019.1616415		MAY 2019	11	Management	Business & Economics	IA4IE	WOS:000469526400001					2021-12-21	
J	Ejohwomu, OA; Oshodi, OS; Lam, KC				Ejohwomu, Obuks Augustine; Oshodi, Olalekan Shamsideen; Lam, Ka Chi			Nigeria's construction industry: barriers to effective communication	ENGINEERING CONSTRUCTION AND ARCHITECTURAL MANAGEMENT			English	Article						Communication; Nigeria; Organizations; Construction industry; Attribution theory; Barriers	ATTRIBUTION THEORY; PROJECTS; MANAGEMENT; RESPONSES; LANGUAGE; FAILURE; SECTOR; IMPACT; DELAYS; SKILLS	Purpose - Communication plays an important role in the quality of the relationship, trust and collaboration among construction project teams. Literature suggests that effective communication is vital for achieving improved project performance. The purpose of this paper is to identify and assess the barriers to effective communication in the Nigerian construction industry, using attribution theory paradigm. Design/methodology/approach - Questionnaires detailing 15 barriers to effective communication were administered to consultants and contractors engaged in the Nigerian construction sector. In total, 100 valid responses were analysed using mean score, factor analysis and factor score. Findings - Unclear project objectives, ineffective reporting systems and poor leadership were ranked as the most significant barriers to effective communication. Factor analysis uncovered that the principal reasons responsible for ineffective communication include: managerial and technical barriers and credibility and background barriers. Practical implications - The results provide information on barriers which needs to be addressed in order to improve communication in construction projects in Nigeria. There is a need to conduct post-completion reviews of construction projects so that project team members can learn and share knowledge on past experiences. Although the present study was conducted in the Nigerian context, it is envisaged that the research outcome will be widely applicable to other developing countries. Originality/value - The study provides insights on the perceived barriers to effective communication in Nigerian construction projects. The paper presents the direction for further research aimed at improving communication in construction projects in Nigeria.	[Ejohwomu, Obuks Augustine] Bells Univ Technol, Dept Management Technol, Ota, Nigeria; [Oshodi, Olalekan Shamsideen; Lam, Ka Chi] City Univ Hong Kong, Dept Architecture & Civil Engn, Hong Kong, Hong Kong, Peoples R China	Oshodi, OS (corresponding author), City Univ Hong Kong, Dept Architecture & Civil Engn, Hong Kong, Hong Kong, Peoples R China.	ososhodi2-c@my.cityu.edu.hk	Ejohwomu, Obuks/AAF-2217-2019	Ejohwomu, Obuks/0000-0001-7098-8999; OSHODI, Olalekan/0000-0001-6106-7717				81	11	12	5	21	EMERALD GROUP PUBLISHING LTD	BINGLEY	HOWARD HOUSE, WAGON LANE, BINGLEY BD16 1WA, W YORKSHIRE, ENGLAND	0969-9988	1365-232X		ENG CONSTR ARCHIT MA	Eng. Constr. Archit. Manag.		2017	24	4					652	667		10.1108/ECAM-01-2016-0003			16	Engineering, Industrial; Engineering, Civil; Management	Engineering; Business & Economics	FC4GJ	WOS:000406796900006		Green Submitted			2021-12-21	
J	Matthews, J; Stanley, T; Davidson, P				Matthews, Judy; Stanley, Tracy; Davidson, Paul			Human factors and project challenges influencing employee engagement in a project-based organisation (PBO)	INTERNATIONAL JOURNAL OF MANAGING PROJECTS IN BUSINESS			English	Article						Employee engagement; Team climate; Knowledge development; Qualitative study; Human factors; Manager behaviours; Project challenges; Learning and knowledge development	WORK ENGAGEMENT; PSYCHOLOGICAL CONDITIONS; SATISFACTION; PERFORMANCE; MOTIVATION; BEHAVIOR	Purpose The purpose of this paper is to provide insights into the project challenges, human factors and knowledge development that influence the nature of employee engagement in a project team within a global project-based organisation. Design/methodology/approach A qualitative research design used semi-structured interviews, and observations in team meetings and the work environment to identify characteristics in the work environment which influenced employee engagement. Findings Workplace characteristics that influence employee engagement relate to the project challenges, the problem-solving nature of work, and achieving specified outcomes within time allocations. Human factors including the manager's behaviours with feedback and recognition of effort, mentoring, and encouraging collaboration are important in team environment. The potential for learning and knowledge development from the project and with the team positively influence engagement. Research limitations/implications This study examines the characteristics of an established project team of 13 consultant engineers from eight nationalities, and forms a basis for future comparison with other project teams with different job types and demographic profiles. Practical implications This study contributes to project management (PM) research by broadening the focus from human factors influencing employee engagement to project challenges and knowledge development, with implications for managers in project-based organisations in terms of job design, development of team climate, team processes and their own behaviours. Originality/value This study contributes to human factors in PM literature through exploratory research into the antecedents of employee engagement.	[Matthews, Judy; Davidson, Paul] Queensland Univ Technol, Sch Business, Sch Management, Brisbane, Qld, Australia; [Stanley, Tracy] Queensland Univ Technol, Sch Business, Brisbane, Qld, Australia	Matthews, J (corresponding author), Queensland Univ Technol, Sch Business, Sch Management, Brisbane, Qld, Australia.	jh.matthews@qut.edu.au; tracy.stanleyu21@gmail.com; p.davidson@qut.edu.au	Matthews, Judy/I-9723-2012	Matthews, Judy/0000-0002-1117-0780				51	5	5	3	32	EMERALD GROUP PUBLISHING LTD	BINGLEY	HOWARD HOUSE, WAGON LANE, BINGLEY BD16 1WA, W YORKSHIRE, ENGLAND	1753-8378	1753-8386		INT J MANAG PROJ BUS	Int. J. Manag. Proj. Bus.		2018	11	4					873	885		10.1108/IJMPB-04-2017-0043			13	Business; Management	Business & Economics	GQ2VJ	WOS:000441516600002					2021-12-21	
J	Abu El-Maaty, AE; El-Kholy, AM; Akal, AY				Abu El-Maaty, Ahmed Ebrahim; El-Kholy, Amr M.; Akal, Ahmed Yousry			Modeling schedule overrun and cost escalation percentages of highway projects using fuzzy approach	ENGINEERING CONSTRUCTION AND ARCHITECTURAL MANAGEMENT			English	Article						Regression analysis; SPSS; Mathematical modeling; Schedule overrun; Cost escalation and Highway projects; Statistical fuzzy model	ROAD CONSTRUCTION PROJECTS; DELAY; PERFORMANCE	Purpose - Modeling represents the art of translating problems from an application area into tractable mathematical formulations whose theoretical and numerical analysis provides insight, answers and guidance useful for the originating application. The purpose of this paper is to determine the causal causes of schedule overrun and cost escalation of highway projects in Egypt in order to be used as independents variables in mathematical models for predicting the percentages of schedule overrun and cost escalation of such projects in Egypt. Design/methodology/approach - A survey of a randomly selected samples yielded responses from 40 owners, 15 consultants and 56 contractors. The survey includes 38 schedule overrun factors and 26 cost escalation factors. The effectiveness degree of the identified factors has been identified by the triangle fuzzy approach. Findings - The results of the survey show that "contractor's technical staff is insufficient and ineligible to accomplish the project" is the most important cause of schedule overrun, while the major cause of cost escalation is inadequate preparation of the project concerning planning and execution. Originality/value - The main contribution of this study is predicting the percentages of schedule overrun and cost escalation of highway projects in Egypt. Through the application of the linear regression analysis method and statistical fuzzy theory, four predictive models have been developed and it has been noted that the linear regression-based model shows prediction accuracy better than statistical fuzzy-based model in predicting percentages of schedule overrun and cost escalation.	[Abu El-Maaty, Ahmed Ebrahim] Menoufia Univ, Dept Civil Engn, Shibin Al Kawm, Egypt; [El-Kholy, Amr M.] Beni Suef Univ, Fac Engn, Bani Suwayf, Egypt; [Akal, Ahmed Yousry] Higher Inst Engn & Technol, Dept Civil Engn, Kafr Al Sheikh, Egypt	Abu El-Maaty, AE (corresponding author), Menoufia Univ, Dept Civil Engn, Shibin Al Kawm, Egypt.	maaty5000@yahoo.com	El-Kholy, Amr Metwally/AAH-8365-2020	El-Kholy, Amr/0000-0002-1424-7085				46	13	13	0	20	EMERALD GROUP PUBLISHING LTD	BINGLEY	HOWARD HOUSE, WAGON LANE, BINGLEY BD16 1WA, W YORKSHIRE, ENGLAND	0969-9988	1365-232X		ENG CONSTR ARCHIT MA	Eng. Constr. Archit. Manag.		2017	24	5					809	827		10.1108/ECAM-03-2016-0084			19	Engineering, Industrial; Engineering, Civil; Management	Engineering; Business & Economics	FH4OI	WOS:000411134400006					2021-12-21	
J	Kim, SY; Nguyen, MV; Dao, TTN				Kim, Soo Yong; Nguyen, Minh V.; Dao, Tuyen T. N.			Prioritizing complexity using fuzzy DANP: case study of international development projects	ENGINEERING CONSTRUCTION AND ARCHITECTURAL MANAGEMENT			English	Article						Complexity; DANP; Fuzzy logic; International development project; Research framework	PERFORMANCE EVALUATION; DEMATEL; CONSTRUCTION; CRITERIA; MODEL; MANAGEMENT	Purpose This paper aims to propose a comprehensive framework for prioritizing complexity criteria. The framework was validated by applying in infrastructure international development (ID) project as a case study. Design/methodology/approach A literature review highlighted the limitations of existing complexity prioritization methods. Then, a combination of the fuzzy decision-making trial and evaluation laboratory (DEMATEL) and fuzzy analytic network process (ANP) was employed as a foundation to develop a three-stage complexity prioritization framework. Focus group discussion and questionnaire surveys were used to practically test the framework in the infrastructure ID projects. Findings The three-stage complexity prioritization framework was validated to be reliable and feasible. The findings showed ability of consultants, scope uncertainties, site compensation and clearance, communication between stakeholders, administrative procedure and project duration were the most significant complexity criteria of ID projects in the Vietnamese context. Practical implications The framework is a robust tool that enables the researchers to grasp the interaction of complexity criteria for complexity prioritization. Later studies can apply the proposed framework, with some minor revisions, to assess the interaction of criteria in other research topics in, and beyond, project complexity. Results of the case study suggest project stakeholders focusing on complex interactions among criteria to reduce project complexity. Originality/value This study contributes to the body of knowledge by providing a comprehensive complexity prioritization framework that grasps the interrelationship of complexity criteria. For stakeholders of ID projects, the findings provide insightful perspectives to understand complexity, which can help to enhance project performance.	[Kim, Soo Yong] Pukyong Natl Univ, Dept Civil Engn, Busan, South Korea; [Nguyen, Minh V.] Pukyong Natl Univ, Dept Construct Management, Grad Sch, Busan, South Korea; [Dao, Tuyen T. N.] Thanh Son Tinh Co Ltd, Long Khanh City, Vietnam	Nguyen, MV (corresponding author), Pukyong Natl Univ, Dept Construct Management, Grad Sch, Busan, South Korea.	kims@pknu.ac.kr; minhnguyenacademic@gmail.com; daotuyen.cm@gmail.com	Nguyen, Minh V./AAY-4206-2020	Nguyen, Minh V./0000-0003-3278-8608	Pukyong National University	This work was supported by a Research Grant of Pukyong National University (2019). The authors would like to appreciate Mrs. Tran Thu Tra, Mrs. Tran Thi Viet Nga, and Mr. Truong Cong Viet Anh for their helping during data collection. The authors also appreciate all anonymous reviewers for their valuable comments.		65	2	2	5	22	EMERALD GROUP PUBLISHING LTD	BINGLEY	HOWARD HOUSE, WAGON LANE, BINGLEY BD16 1WA, W YORKSHIRE, ENGLAND	0969-9988	1365-232X		ENG CONSTR ARCHIT MA	Eng. Constr. Archit. Manag.	APR 28	2021	28	4					1114	1133		10.1108/ECAM-04-2020-0265		AUG 2020	20	Engineering, Industrial; Engineering, Civil; Management	Engineering; Business & Economics	RW8JJ	WOS:000558344800001					2021-12-21	
J	Owolabi, HA; Oyedele, LO; Alaka, HA; Ajayi, SO; Akinade, OO; Bilal, M				Owolabi, Hakeem A.; Oyedele, Lukumon O.; Alaka, Hafiz A.; Ajayi, Saheed O.; Akinade, Olugbenga O.; Bilal, Muhammad			Critical Success Factors for Ensuring Bankable Completion Risk in PFI/PPP Megaprojects	JOURNAL OF MANAGEMENT IN ENGINEERING			English	Article						Bankability; Risk; Public-private partnership (PPP); Private finance initiative (PFI); Megaprojects; Financiers' perspective	MEGA CONSTRUCTION PROJECTS; ENERGY PROJECTS; PPP; MANAGEMENT; DELAY; MODEL	This study investigates project financiers' perspectives on the bankability of completion risk in private finance initiative and public-private partnership (PFI/PPP) megaprojects. Using a mixed methodology approach, focus group discussions with financier stakeholders in the UK's PFI/PPP industry were used to identify 23 criteria relevant for evaluating completion risk in funding applications. These criteria were put in a questionnaire survey to wider audiences of financiers of PFI/PPP projects in the UK. A series of statistical tests were performed, including reliability analysis, Kruskal-Wallis nonparametric test, descriptive statistics, principal rank agreement factor (PRAF), and regression analysis. After identifying 21 reliable criteria influencing the bankability of completion risk, the general agreement of three major financier stakeholders (senior lenders, equity financiers, and infrastructure financiers) on all criteria were examined through the Kruskal-Wallis test and PRAF. A regression model, constructed and validated with input from another team of expert financiers, revealed five key criteria influencing the bankability of completion risk in PPP megaprojects. These include (1) a construction contractor with years of experience of successful completion of megaprojects, (2) the construction contractor's financial strength, (3) the existence of tried-and-tested technology for the construction of project, (4) the availability of an independent technical consultant (ITC), and (5) the existence of a fixed-price turnkey (FPTK) construction contract. The research findings will provide PFI/PPP contractors and clients with valuable strategies for satisfying financiers' requirements in delivering large-scale infrastructure PPP projects.	[Owolabi, Hakeem A.] Univ West England, Project Analyt & Digital Enterprise, Big Data Enterprise & Artificial Intelligence Lab, Frenchay Campus,Coldhabour Lane, Bristol BS16 1QY, Avon, England; [Oyedele, Lukumon O.] Univ West England, Digital Innovat & Enterprise, Frenchay Campus,Coldhabour Lane, Bristol BS16 1QY, Avon, England; [Alaka, Hafiz A.] Univ Hertfordshire, Digital Technol & Innovat, Hatfield AL10 9AB, Herts, England; [Alaka, Hafiz A.] Coventry Univ, Fac Energy Construct & Environm, Civil Engn Management, Prior St, Coventry CV1 5FB, W Midlands, England; [Ajayi, Saheed O.] Leeds Beckett Univ, Digital Construct & Project Management, City Campus, Leeds LS1 3HE, W Yorkshire, England; [Ajayi, Saheed O.] Leeds Beckett Univ, Sch Built Environm & Engn, City Campus, Leeds LS1 3HE, W Yorkshire, England; [Akinade, Olugbenga O.; Bilal, Muhammad] Univ West England, Big Data Applicat Dev, Big Data Enterprise & Artificial Intelligence Lab, Frenchay Campus,Coldhabour Lane, Bristol BS16 1QY, Avon, England	Oyedele, LO (corresponding author), Univ West England, Digital Innovat & Enterprise, Frenchay Campus,Coldhabour Lane, Bristol BS16 1QY, Avon, England.	Hakeem.Owolabi@uwe.ac.uk; Ayolook2001@yahoo.co.uk; h.alaka@herts.ac.uk; Saheed.ajayi@leedsbeckett.ac.uk; olugbenga.akinade@uwe.ac.uk; muhammad.bilal@uwe.ac.uk	Ajayi, Saheed/AAV-4209-2021					71	12	12	29	142	ASCE-AMER SOC CIVIL ENGINEERS	RESTON	1801 ALEXANDER BELL DR, RESTON, VA 20191-4400 USA	0742-597X	1943-5479		J MANAGE ENG	J. Manage. Eng.	JAN 1	2020	36	1							04019032	10.1061/(ASCE)ME.1943-5479.0000717			16	Engineering, Industrial; Engineering, Civil	Engineering	JO3ZI	WOS:000497518900007		Green Accepted			2021-12-21	
J	Leung, MY; Chan, YS; Chong, A; Sham, JFC				Leung, Mei-yung; Chan, Yee-shan; Chong, Alice; Sham, Janet Fung-Chu			Developing structural integrated stressor-stress models for clients' and contractors' cost engineers	JOURNAL OF CONSTRUCTION ENGINEERING AND MANAGEMENT			English	Article							WORK-ENVIRONMENT; A BEHAVIOR; ORGANIZATIONS; SUPPORT; BURNOUT	Estimation is not a purely scientific task. It requires cost engineers equipped with a wide knowledge of construction and a professional ability to make judgments. However, stress will deaden their use of knowledge and influence their professional judgment in estimating. In the construction industry, cost engineers can generally be divided into two main groups: clients' cost engineers in consultant firms or in a development company who serve clients; and contractors' cost engineers in construction companies working for the contractors. This study investigates the causal relationships between the stressors and stress of clients' and contractors' cost engineers. Two stressor-stress integrated models were developed for these two cost engineer groups by using the structural equation model. The findings revealed some stressors that affected both clients' and contractors' cost engineers: (1) poor environment, role conflict and work underload affect their stress positively; (2) social support and Type A behavior affect their stress negatively; and (3) work underload induces stress via the role conflict among cost engineers, their supervisors, and the organization. On the other hand, some deviations between these two groups of cost engineers also occur: (1) social support acts as a source of stressors of clients' cost engineers; (2) a private life stressor only affects the stress of contractors' cost engineers; and (3) a closed interactive looping relationship among role conflict, Type A behavior, and work underload affects contractors' cost engineers. Based on the results of this study, some recommendations are suggested to manage cost engineers' stress well.	[Leung, Mei-yung; Chan, Yee-shan; Sham, Janet Fung-Chu] City Univ Hong Kong, Dept Bldg & Construct, Kowloon Tong, Hong Kong, Peoples R China; [Chong, Alice] City Univ Hong Kong, Dept Appl Social Studies, Kowloon Tong, Hong Kong, Peoples R China	Leung, MY (corresponding author), City Univ Hong Kong, Dept Bldg & Construct, Tat Chee Ave, Kowloon Tong, Hong Kong, Peoples R China.	bcmei@cityu.edu.hk	Leung, Mei-yung/K-4075-2015; Chong, Alice/P-4008-2015; Chong, Alice M.L./K-7412-2019	Leung, Mei-yung/0000-0003-4186-2347; Chong, Alice/0000-0002-5727-1325; Chong, Alice M.L./0000-0002-5727-1325; Sham, Janet Fung Chu/0000-0001-6424-5734				50	22	22	3	16	ASCE-AMER SOC CIVIL ENGINEERS	RESTON	1801 ALEXANDER BELL DR, RESTON, VA 20191-4400 USA	0733-9364	1943-7862		J CONSTR ENG M	J. Constr. Eng. Manage.	AUG	2008	134	8					635	643		10.1061/(ASCE)0733-9364(2008)134:8(635)			9	Construction & Building Technology; Engineering, Industrial; Engineering, Civil	Construction & Building Technology; Engineering	327XS	WOS:000257762400008					2021-12-21	
