PT	AU	BA	BE	GP	AF	BF	CA	TI	SO	SE	BS	LA	DT	CT	CY	CL	SP	HO	DE	ID	AB	C1	RP	EM	RI	OI	FU	FX	CR	NR	TC	Z9	U1	U2	PU	PI	PA	SN	EI	BN	J9	JI	PD	PY	VL	IS	PN	SU	SI	MA	BP	EP	AR	DI	D2	EA	PG	WC	SC	GA	UT	PM	OA	HC	HP	DA
J	Raouf, AM; Al-Ghamdi, SG				Raouf, Ayman M.; Al-Ghamdi, Sami G.			Framework to evaluate quality performance of green building delivery: construction and operational stage	INTERNATIONAL JOURNAL OF CONSTRUCTION MANAGEMENT			English	Article; Early Access						Green buildings; quality performance; project delivery systems; sustainability; construction quality; operational quality	PROJECTS	Quality performance in construction is the degree of compliance with the specifications against which the work was executed. Green buildings extend the compliance to sustainability-related aspects to ensure that the energy and water consumption is conserved, promote a healthy indoor environmental quality and reducing the detrimental impacts of the construction activities on the environment. The operational stage reflects the construction workmanship and the effectiveness of the design solution to achieve the sustainability requirements through the overall building performance. Procedures for maintenance and overhauling extend the longevity of buildings. Green buildings exhibit underperformance caused by inadequate construction practices and a lack of understanding of the operations and maintenance practices. This research serves to tackle this problem through a comprehensive and forward-looking framework to depict construction- and operation-related quality activities through an integrated definition for the function modeling (IDEF0) process model. Semi-structured interviews and a focus group validate the framework's suitability and its implementation offered revelations from industry practitioners on the factors affecting quality procedures from assigned metrics, liaison of staff from different project lifecycle stages, green building technologies, commissioning and retro-commissioning and impact of project delivery systems adopted especially in isolating operational liaison. The contributions of this work reinforce the impact of quality on the sustainability objectives that a green building is envisioned to serve, and through capturing the pre-, during, and post-construction lifecycle, the compliance and performance quality aspects are combined in a more integrated manner.	[Raouf, Ayman M.; Al-Ghamdi, Sami G.] Hamad Bin Khalifa Univ, Qatar Fdn, Coll Sci & Engn, Div Sustainable Dev, Doha, Qatar	Al-Ghamdi, SG (corresponding author), Hamad Bin Khalifa Univ, Qatar Fdn, Coll Sci & Engn, Div Sustainable Dev, Doha, Qatar.	salghamdi@hbku.edu.qa	Al-Ghamdi, Sami G./AAH-6959-2020	Al-Ghamdi, Sami G./0000-0002-7416-5153	Qatar National Library	Open Access funding provided by the Qatar National Library.		65	2	2	5	7	TAYLOR & FRANCIS LTD	ABINGDON	2-4 PARK SQUARE, MILTON PARK, ABINGDON OR14 4RN, OXON, ENGLAND	1562-3599	2331-2327		INT J CONSTR MANAG	Int. J. Constr. Manag.												10.1080/15623599.2020.1858539		DEC 2020	15	Management	Business & Economics	PI3OX	WOS:000601005300001		hybrid			2021-12-21	
J	Gurgun, AP; Koc, K				Gurgun, Asli Pelin; Koc, Kerim			Contractor prequalification for green buildings-evidence from Turkey	ENGINEERING CONSTRUCTION AND ARCHITECTURAL MANAGEMENT			English	Article						Green building; Prequalification; Construction industry; Decision making; AHP; MCDM	DECISION-SUPPORT-SYSTEM; MAKING MODEL; CONSTRUCTION; SELECTION; CRITERIA; AHP; SUSTAINABILITY; IMPACTS; RISKS; STATE	Purpose Competent contractors are one of the critical stakeholders to achieve targeted sustainability objectives in green building (GB) projects. Prior to contractor selection, prequalification is an important step, which requires contractors with certain capabilities in addition to traditional features. This study aims to develop a systematic and practical model for prequalification in GB projects using a multi-criteria decision-making (MCDM) approach by adopting the analytical hierarchy process (AHP). Design/methodology/approach The AHP model with 8 main criteria groups and 25 sub-criteria is structured based on literature review and professional opinions accompanied by a pilot study. Then, interviews with experts, who are experienced in the development and application phases of GB projects in Turkey, are arranged to collect judgements. The agreement levels between different groups of experts are analysed via Pearson's and Spearman's rank correlation coefficient. Model applicability is tested on six hypothetical contractors for practicality. Findings The results show that i) financial capabilities, ii) legal status and iii) sustainability groups are the top three main criteria, while i) compliance with schedule requirements of the client, ii) current legal status including suits, iii) negative litigation history records, iv) contractor's compliance capacity to client's sustainability checklist for the proposed project and v) sustainability with lower life cycle cost (durability, maintenance, constructability) are the top five sub-criteria. Originality/value There is a gap in the literature analysing contractor prequalification phase in GB projects. This study attempts to fill this lack provided with a practical evaluation tool.	[Gurgun, Asli Pelin; Koc, Kerim] Yildiz Tech Univ, Dept Civil Engn, Istanbul, Turkey	Gurgun, AP (corresponding author), Yildiz Tech Univ, Dept Civil Engn, Istanbul, Turkey.	apelin@yildiz.edu.tr	Koc, Kerim/AAY-7448-2020	Koc, Kerim/0000-0002-6865-804X				79	15	15	2	16	EMERALD GROUP PUBLISHING LTD	BINGLEY	HOWARD HOUSE, WAGON LANE, BINGLEY BD16 1WA, W YORKSHIRE, ENGLAND	0969-9988	1365-232X		ENG CONSTR ARCHIT MA	Eng. Constr. Archit. Manag.	JUL 20	2020	27	6					1377	1400		10.1108/ECAM-10-2019-0543		JAN 2020	24	Engineering, Industrial; Engineering, Civil; Management	Engineering; Business & Economics	ME4JL	WOS:000512577500001					2021-12-21	
J	Ahuja, R; Sawhney, A; Arif, M				Ahuja, Ritu; Sawhney, Anil; Arif, Mohammed			Developing organizational capabilities to deliver lean and green project outcomes using BIM	ENGINEERING CONSTRUCTION AND ARCHITECTURAL MANAGEMENT			English	Article						Organizational capabilities; Building information modelling; AEC sector; BIM capabilities; Lean principles; Green principles	INFORMATION MODELING BIM; AS-BUILT BIM; FACILITY MANAGEMENT; EMBODIED ENERGY; SITE LAYOUT; CONSTRUCTION; DESIGN; FRAMEWORK; BUILDINGS; IMPROVE	Purpose The purpose of this paper is to describe the process through which an organization develops organizational capabilities by tapping the technical skills and social skills of its employees in the use of Building Information Modeling (BIM) to deliver lean and green project outcomes. The resulting framework for BIM-based organizational capabilities development comprising of three hierarchical layers - technology, process and outcomes - is explained. Design/methodology/approach For this study, BIM has been identified as an enabler and a process for achieving lean and green outcomes on construction projects. Based on a detailed literature review, this paper identifies the organizational capabilities needed by the architecture, engineering and construction organizations to effectively implement BIM on construction projects. The study has been conducted through a sequential mixed-method approach involving semi-structured interviews, focus groups and qualitative comparative analyses. Findings It was discovered that to attain desired project outcomes, an organization needs to embrace an underlying BIM adoption culture not only within its project teams but also within the organization as a whole. The study also concluded that an integrated approach to BIM usage - connecting it with lean and green initiatives - on construction projects resulted in improved project outcomes, especially ones targeting lean and green aspects of improvements. Practical implications The proposed outline for BIM-based organizational capabilities will help the organizations focus on the human factors along with the technical factors while striving for successful usage within their organizations. Originality/value Using the organizational capabilities matrix, this paper highlights the importance of technical and social skill sets of an individual employee and their role in developing the organizational capabilities to gain the desired lean and green outcomes.	[Ahuja, Ritu] Amity Univ, RICS Sch Built Environm, Sch Construct, Noida, India; [Sawhney, Anil] Liverpool John Moores Univ, Fac Engn & Technol, Dept Built Environm, Liverpool, Merseyside, England; [Arif, Mohammed] Univ Wolverhampton, Fac Sci & Engn, Sch Architecture & Built Environm, Wolverhampton, W Midlands, England	Sawhney, A (corresponding author), Liverpool John Moores Univ, Fac Engn & Technol, Dept Built Environm, Liverpool, Merseyside, England.	a.sawhney@ljmu.ac.uk	Sawhney, Anil/K-7519-2013; Sawhney, Anil/AAQ-6168-2020	Sawhney, Anil/0000-0002-4988-4893; Sawhney, Anil/0000-0002-4988-4893				136	7	7	8	74	EMERALD GROUP PUBLISHING LTD	BINGLEY	HOWARD HOUSE, WAGON LANE, BINGLEY BD16 1WA, W YORKSHIRE, ENGLAND	0969-9988	1365-232X		ENG CONSTR ARCHIT MA	Eng. Constr. Archit. Manag.		2018	25	10			SI		1255	1276		10.1108/ECAM-08-2017-0175			22	Engineering, Industrial; Engineering, Civil; Management	Engineering; Business & Economics	GX4TR	WOS:000447729600002		Green Submitted, Green Accepted			2021-12-21	
J	Chan, APC; Darko, A; Ameyaw, EE; Owusu-Manu, D				Chan, Albert P. C.; Darko, Amos; Ameyaw, Ernest E.; Owusu-Manu, De-Graft			Barriers Affecting the Adoption of Green Building Technologies	JOURNAL OF MANAGEMENT IN ENGINEERING			English	Article						Green building; Barriers; Construction industry; Sustainable development	ENERGY EFFICIENCY; CONSTRUCTION; DRIVERS; AWARENESS; DESIGN	Green building (GB) is gaining increased acceptance in the construction industry as a viable solution for meeting the growing demand for environmentally friendly or healthy buildings. However, the uptake of GB technologies is not as apparent as it should have been. This paper aims to examine the criticality of various barriers preventing the wider adoption of GB technologies. Results from statistical analyses of 104 questionnaire survey responses from GB experts around the world are presented. The results validated the criticality of 19 of the 26 barriers used for the survey. Respondents from different countries and with diverse backgrounds displayed broad consensus on the criticality levels of the barriers. Resistance of stakeholders to change and higher cost are identified as the most critical barriers to implementing GB technologies. Generally, the various groups of respondents shared similar views on the number of barriers affecting the industry; however, respondents with more than 15years of experience in GB perceived fewer barriers. The factor analysis showed that the barriers to GB technologies adoption could be grouped into five main interrelated components, which suggest the need for holistic and integrated strategies to overcome the barriers. The findings of this paper could help policy makers identify specific problems in GB technologies adoption and develop suitable strategies for their wider uptake. From the perspective of international experts, this study contributes to the body of knowledge about GB barriers.	[Chan, Albert P. C.; Darko, Amos] Hong Kong Polytech Univ, Dept Bldg & Real Estate, 11 Yuk Choi Rd, Kowloon, Hong Kong, Peoples R China; [Ameyaw, Ernest E.] Univ Kingston, Dept Construct & Surveying, Kingston Upon Thames KT1 2EE, Southwest Londo, England; [Owusu-Manu, De-Graft] Kwame Nkrumah Univ Sci & Technol, Dept Bldg Technol, Kumasi, Ghana	Darko, A (corresponding author), Hong Kong Polytech Univ, Dept Bldg & Real Estate, 11 Yuk Choi Rd, Kowloon, Hong Kong, Peoples R China.	albert.chan@polyu.edu.hk; amos.darko@connect.polyu.hk; myernest2010@yahoo.com; d.owusumanu@gmail.com	Chan, Albert/I-4650-2012; Darko, Amos/C-4721-2018	Chan, Albert/0000-0002-4853-6440; Darko, Amos/0000-0002-7978-6039; Ameyaw, Ernest E./0000-0001-6708-7647	Department of Building and Real Estate, Hong Kong Polytechnic University	The present study forms part of a Ph.D. study where related papers, but with different scopes and objectives have been published. The authors acknowledge the Department of Building and Real Estate, Hong Kong Polytechnic University for funding this research. The authors are also grateful to the experts who participated in the questionnaire survey. In addition, it is acknowledged that the research methodology reported in this paper is similar to that of other papers produced from the international survey. Appreciation is finally due to the editors and anonymous reviewers who provided invaluable comments and suggestions that helped to improve this paper.		75	63	63	6	82	ASCE-AMER SOC CIVIL ENGINEERS	RESTON	1801 ALEXANDER BELL DR, RESTON, VA 20191-4400 USA	0742-597X	1943-5479		J MANAGE ENG	J. Manage. Eng.	MAY	2017	33	3							04016057	10.1061/(ASCE)ME.1943-5479.0000507			12	Engineering, Industrial; Engineering, Civil	Engineering	ER1GI	WOS:000398537700015					2021-12-21	
J	Ruiz, MC; Fernandez, I				Ruiz, M. C.; Fernandez, I.			Environmental assessment in construction using a Spatial Decision Support System	AUTOMATION IN CONSTRUCTION			English	Article						Environmental assessment; Building; Spatial system	GREEN BUILDING CHALLENGE; LAND-USE; GIS; PERFORMANCE; FRAMEWORK	This research proposes a Spatial Decision Support System based on the Geographical Information System (GIS) to evaluate the environmental performance in construction. The system has been designed to add a spatial component to the current tools for the inspection and management of the sustainability of buildings and to assist the planners in their decision-making. The multi-criteria evaluation method developed in the Green Building Challenge and implemented in the software SbTool has been used as a reference. The evaluation method presents a hierarchical structure of criteria and variables which is applied to buildings spatially indexed in GIS and the environmental data of the buildings comes from an external data-base developed in Access. In order to validate the system, the environmental assessment of a group of residential, industrial and public service buildings during the phases of operation was simulated. The application of this tool in the inspection and environmental assessment of buildings allows the geographical scale of analysis to be extended to a group of buildings within the area of interest and consequently to extend the limits of its usefulness within the field of planning and environmental assessment. (c) 2009 Elsevier B.V. All rights reserved.	[Ruiz, M. C.; Fernandez, I.] Univ Cantabria, Dpt Transport & Technol Projects & Proc, Escuela Tecn Super Ingenieros Ind & Telecomunicac, E-39005 Santander, Cantabria, Spain	Ruiz, MC (corresponding author), Univ Cantabria, Dpt Transport & Technol Projects & Proc, Escuela Tecn Super Ingenieros Ind & Telecomunicac, Av Los Castros S-N, E-39005 Santander, Cantabria, Spain.	ruizpm@unican.es	Fernandez, Inmaculada/I-4502-2015; Ruiz-Puente, Carmen/K-4161-2015	Fernandez, Inmaculada/0000-0002-9618-2114; Ruiz-Puente, Carmen/0000-0001-5854-9694				35	23	23	0	10	ELSEVIER	AMSTERDAM	RADARWEG 29, 1043 NX AMSTERDAM, NETHERLANDS	0926-5805	1872-7891		AUTOMAT CONSTR	Autom. Constr.	DEC	2009	18	8					1135	1143		10.1016/j.autcon.2009.07.005			9	Construction & Building Technology; Engineering, Civil	Construction & Building Technology; Engineering	513ST	WOS:000271344400010					2021-12-21	
J	Durdyev, S; Mohandes, SR; Mandiyar, A; Ismail, S				Durdyev, Serdar; Mohandes, Saeed Reza; Mandiyar, Amir; Ismail, Syuhaida			What drives clients to purchase green building?: The cybernetic fuzzy analytic hierarchy process approach	ENGINEERING CONSTRUCTION AND ARCHITECTURAL MANAGEMENT			English	Article; Early Access						Construction; Methodology; Decision support systems	EXTENT ANALYSIS METHOD; NETWORK PROCESS MODEL; WILLINGNESS-TO-PAY; DECISION-MAKING; SUSTAINABLE CONSTRUCTION; DELPHI METHOD; PLANNED BEHAVIOR; HEALTHY CITIES; AHP METHOD; SAFETY	Purpose Homebuyers' motivation to purchase the green building (GB) is vital for the widespread adoption of greener practices and for tackling the adverse impact of the built environment. In this regard, through the lenses of qualified and competent GB developers (GBD) and real estate agents (REAs) using judgment sampling technique, this paper aims to evaluate the factors stimulating the purchase intention of Malaysian homebuyers. Design/methodology/approach The study uses the interval-valued fuzzy Delphi method (IVFDM) to identify influential factors, while the cybernetic fuzzy analytic hierarchy process (CFAHP) for prioritizing the identified factors according to their significance in nationwide promotion of GBs is utilized. Findings The findings, which are consistent with those reported in the literature and validated by the focus group, uncover the most prominent factors that drive the purchase intention of GB homebuyers. The results indicate that the homebuyers are familiar with the benefits of GB; however, the benefits are not sufficient to overcome the perceived "high cost" of green practices. Hence, homebuyers still seek financial incentives, which is a clear indication that financial issues are the most motivating factor. Practical implications Increase in informative promotion of GB is necessary, particularly among prospective homebuyers in developing countries where GB adoption is in its infancy. Frontline players (those who are responsible for wider promotion) can utilize the factors that this study found to be important to identify appropriate steps to increase prospective homebuyers' motivation for purchasing greener dwellings. Originality/value The contribution of this paper is threefold. First, review and identification of the most cited determinants that have been reported in the context of the subject. Second, this paper presents the most significant determinants in a developing country setting through the lenses of Malaysian experts in the area. Third, improvement measures could be implemented in Malaysia and other developing countries to promote the GB paradigm with an aim to make the building environment more sustainable.	[Durdyev, Serdar; Ismail, Syuhaida] Ara Inst Canterbury, Engn & Architectural Studies, Christchurch, New Zealand; [Mohandes, Saeed Reza] Hong Kong Polytech Univ, Dept Bldg & Real Estate, Kowloon, Hong Kong, Peoples R China; [Mandiyar, Amir] Univ Sains Malaysia, George Town, Malaysia	Durdyev, S (corresponding author), Ara Inst Canterbury, Engn & Architectural Studies, Christchurch, New Zealand.	durdyevs@ara.ac.nz	Durdyev, Serdar/T-7347-2019; Mahdiyar, Amir/N-8558-2016	Durdyev, Serdar/0000-0003-1781-1830; Mahdiyar, Amir/0000-0002-8075-5918; MOHANDES, SAEED REZA/0000-0001-9149-3928				104	0	0	10	10	EMERALD GROUP PUBLISHING LTD	BINGLEY	HOWARD HOUSE, WAGON LANE, BINGLEY BD16 1WA, W YORKSHIRE, ENGLAND	0969-9988	1365-232X		ENG CONSTR ARCHIT MA	Eng. Constr. Archit. Manag.												10.1108/ECAM-11-2020-0945		SEP 2021	25	Engineering, Industrial; Engineering, Civil; Management	Engineering; Business & Economics	UO8HW	WOS:000694933200001					2021-12-21	
J	Xue, J; Shen, GQP; Yang, RJ; Zafar, I; Ekanayake, EMAC				Xue, Jin; Shen, Geoffrey Qiping; Yang, Rebecca Jing; Zafar, Irfan; Ekanayake, E. M. A. C.			Dynamic Network Analysis of Stakeholder Conflicts in Megaprojects: Sixteen-Year Case of Hong Kong-Zhuhai-Macao Bridge	JOURNAL OF CONSTRUCTION ENGINEERING AND MANAGEMENT			English	Article							CONSTRUCTION PROJECTS; DECISION-MAKING; MANAGEMENT; INFRASTRUCTURE; RISKS; PARTICIPATION; PERSPECTIVE; PERFORMANCE; CENTRALITY; FRAMEWORK	Stakeholder conflicts are hard to avoid in the implementation of megaprojects due to the diverse interests and aims among stakeholders. The previous study does not provide much evidence on dynamic patterns of stakeholder conflicts in the project duration from the planning to the construction and handover stage. Therefore, this study established a network-based framework to analyze the dynamics of stakeholder conflicts by detecting the critical conflicts and the affected relationships among stakeholders with a 16-year case study of the Hong Kong-Zhuhai-Macao Bridge project. Finally, a stakeholder-conflict map was proposed to provide management strategies considering the conflict criticalness and stakeholder participation of each stakeholder conflict. After reviewing 1,748 official documents from 2003 to 2018, the chronological features of environmental conflicts, neighboring conflicts, and traditional conflicts are detected. The changes of stakeholder relationships in the project duration are discussed by five stakeholder groups: local industry, green group, supervision group, construction group, and governmental organizations. The Mirror Z strategies of stakeholder conflicts are proposed in the phases of planning, construction, and handover, respectively. (C) 2020 American Society of Civil Engineers.	[Xue, Jin; Shen, Geoffrey Qiping; Zafar, Irfan; Ekanayake, E. M. A. C.] Hong Kong Polytech Univ, Dept Bldg & Real Estate, Kowloon, Hong Kong 999077, Peoples R China; [Yang, Rebecca Jing] RMIT Univ, Sch Property Construct & Project Management, Melbourne Cent, Vic 3001, Australia	Xue, J (corresponding author), Hong Kong Polytech Univ, Dept Bldg & Real Estate, Kowloon, Hong Kong 999077, Peoples R China.	jin.xue@connectpolyu.hk; bsqpshen@polyu.edu.hk; rebecca.yang@rmit.edu.au; irfan.zafar@connect.polyu.hk; anushika.ce.ekanayakemudiyanselage@connect.polyu.hk	Ekanayake, E.M.A.C./AAS-2703-2020; Shen, Qiping/A-1250-2014	Ekanayake, E.M.A.C./0000-0003-2557-4070; Zafar, Irfan/0000-0003-1078-5123; Shen, Qiping/0000-0002-3111-2019; XUE, JIN/0000-0001-9653-1022	National Natural Science Foundation of ChinaNational Natural Science Foundation of China (NSFC) [71671156]	The research described in this paper is fully supported by the National Natural Science Foundation of China (Grant No. 71671156).		72	4	4	18	19	ASCE-AMER SOC CIVIL ENGINEERS	RESTON	1801 ALEXANDER BELL DR, RESTON, VA 20191-4400 USA	0733-9364	1943-7862		J CONSTR ENG M	J. Constr. Eng. Manage.	SEP 1	2020	146	9							04020103	10.1061/(ASCE)CO.1943-7862.0001895			16	Construction & Building Technology; Engineering, Industrial; Engineering, Civil	Construction & Building Technology; Engineering	PU7AD	WOS:000609451500019					2021-12-21	
J	El-Sayegh, SM; Manjikian, S; Ibrahim, A; Abouelyousr, A; Jabbour, R				El-Sayegh, Sameh M.; Manjikian, Solair; Ibrahim, Ahmed; Abouelyousr, Ahmed; Jabbour, Raed			Risk identification and assessment in sustainable construction projects in the UAE	INTERNATIONAL JOURNAL OF CONSTRUCTION MANAGEMENT			English	Article						Risk assessment; sustainable construction; UAE; project risk management		There is a big shift towards sustainable construction projects in the United Arab Emirates (UAE). Sustainable construction projects are riskier than traditional projects. The purpose of this paper is to identify and assess the risks in sustainable construction projects in the UAE. This will help project participants to properly manage these risks in their projects. A list of thirty risks was identified based on literature review. These risks were grouped into five categories: management, technical, green team, green materials and regulatory/economic. A survey was then developed and sent to professionals from the UAE. The respondents evaluated each risk in terms of its probability of occurrence and potential impact. Forty-four responses were collected. The thirty risks were ranked based on the risk severity (probability multiplied by impact). The top five risks are shortage of clients' funding, insufficient or incorrect sustainable design information, design changes, unreasonably tight schedule for sustainable construction and poor scope definition in sustainable construction. Risk identification and assessment are important part of project risk management. This allows for appropriate risk response planning and control.	[El-Sayegh, Sameh M.; Manjikian, Solair; Ibrahim, Ahmed; Abouelyousr, Ahmed; Jabbour, Raed] Amer Univ Sharjah, Civil Engn Dept, Sharjah, U Arab Emirates	El-Sayegh, SM (corresponding author), Amer Univ Sharjah, Civil Engn Dept, Sharjah, U Arab Emirates.	selsayegh@aus.edu						26	24	24	7	19	TAYLOR & FRANCIS LTD	ABINGDON	2-4 PARK SQUARE, MILTON PARK, ABINGDON OR14 4RN, OXON, ENGLAND	1562-3599	2331-2327		INT J CONSTR MANAG	Int. J. Constr. Manag.	APR 3	2021	21	4					327	336		10.1080/15623599.2018.1536963			10	Management	Business & Economics	QX5CP	WOS:000629364500001					2021-12-21	
